title,link,source,snippet,date,absolute_date
Retail sales in Brazil begins year with record high in January,https://www.reuters.com/markets/retail-sales-brazil-begins-year-with-record-high-january-2023-04-12/,Reuters,"SAO PAULO, April 12 (Reuters) - Brazil's retail sector started 2023 stronger than expected and with record high sales in January, although the outlook is...","Apr 12, 2023",2023-04-12
"Comment: Deforestation in the Amazon is a public health crisis, but indigenous peoples can help",https://www.reuters.com/business/sustainable-business/comment-deforestation-amazon-is-public-health-crisis-indigenous-peoples-can-help-2023-04-12/,Reuters,"Many people who live in the Brazilian Amazon dread the arrival of the dry season, roughly June to December. It's when rainclouds give way to smoke from...","Apr 12, 2023",2023-04-12
Brazil's Embraer eyes deal with Chinese airline for 20 E-jets -sources,https://www.reuters.com/business/aerospace-defense/brazils-embraer-eyes-deal-with-chinese-airline-20-e-jets-sources-2023-04-11/,Reuters,Brazilian planemaker Embraer SA aims to sign a deal for the sale of 20 commercial jets to a Chinese airline during President Luiz Inacio Lula da Silva's...,"Apr 11, 2023",2023-04-11
BAE Systems to test CV90 combat vehicle in Brazil before possible purchase decision,https://www.reuters.com/business/aerospace-defense/bae-systems-test-cv90-combat-vehicle-brazil-before-possible-purchase-decision-2023-04-14/,Reuters,"BAE Systems Plc is scheduling a test of its CV90 armored combat vehicle in Brazil this year, an executive told Reuters, as it seeks to provide information...","Apr 14, 2023",2023-04-14
Young victim of Brazil daycare center attack is buried,https://www.reuters.com/world/americas/young-victim-brazil-daycare-center-attack-is-buried-2023-04-06/,Reuters,"Residents of Blumenau, a city in Southern Brazil, gathered on Thursday at a cemetery to attend the burial of one of the four children killed by a man armed...","Apr 6, 2023",2023-04-06
Brazil looks to regulate monetized content on Internet,https://www.reuters.com/world/americas/brazil-looks-regulate-monetized-content-internet-official-2023-03-17/,Reuters,"SAO PAULO, March 17 (Reuters) - The Brazilian government is studying whether to regulate Internet platforms with content that earns revenue such as...","Mar 17, 2023",2023-03-17
Bolsonaro lands back in Brazil to lead right-wing opposition,https://www.reuters.com/world/americas/bolsonaro-lands-back-brazil-lead-right-wing-opposition-2023-03-30/,Reuters,"BRASILIA, March 30 (Reuters) - Brazil's far-right former President Jair Bolsonaro returned from three months in the United States on Thursday and was...","Mar 30, 2023",2023-03-30
Exxon quits drilling in Brazil after failing to find oil - WSJ,https://www.reuters.com/business/energy/exxon-quits-drilling-brazil-after-failing-find-oil-wsj-2023-04-05/,Reuters,"Exxon Mobil Corp has ended a major campaign to find oil in Brazil, the Wall Street Journal reported on Wednesday, citing people familiar with the matter.","Apr 5, 2023",2023-04-05
"Bolsonaro to return to Brazil on March 30, his party says",https://www.reuters.com/world/americas/bolsonaro-return-brazil-march-30-his-party-says-2023-03-24/,Reuters,"March 24 (Reuters) - Former Brazilian President Jair Bolsonaro will return to Brazil on March 30, his party confirmed via social media on Friday,...","Mar 24, 2023",2023-03-24
Bolsonaro returns to Brazil to lead right-wing opposition to Lula,https://www.reuters.com/world/americas/bolsonaro-returns-brazil-lead-right-wing-opposition-lula-2023-03-30/,Reuters,"BRASILIA, March 30 (Reuters) - Brazil's far-right former President Jair Bolsonaro, who never conceded defeat in last year's election, returns from...","Mar 29, 2023",2023-03-29
"With stakes high, Brazil meat industry dominates Lula delegation to China",https://www.reuters.com/markets/commodities/with-stakes-high-brazil-meat-industry-dominates-lula-delegation-china-2023-03-22/,Reuters,"More than a quarter of business leaders traveling to China with President Luiz Inacio Lula da Silva next week come from Brazil's booming meat industry,...","Mar 22, 2023",2023-03-22
Brazil to pay debt to multilateral organizations in 2023,https://www.reuters.com/world/americas/brazil-pay-debt-multilateral-organizations-2023-2023-03-16/,Reuters,"Brazil's government will pay outstanding debts of 2.6 billion reais ($490.6 million) to multilateral organizations in 2023, reinforcing its commitment to...","Mar 16, 2023",2023-03-16
"Brazil's Lula to go to China with 240 business representatives, says official",https://www.reuters.com/world/americas/brazils-lula-go-china-with-240-business-representatives-says-official-2023-03-17/,Reuters,"BRASILIA, March 17 (Reuters) - Brazil's President Luiz Inacio Lula da Silva will visit China this month accompanied by a delegation of 240 business...","Mar 17, 2023",2023-03-17
Brazil's BTG Pactual launches own dollar-backed stablecoin,https://www.reuters.com/business/finance/brazils-btg-pactual-launches-own-dollar-backed-stablecoin-2023-04-04/,Reuters,"SAO PAULO, April 4 (Reuters) - Brazil's BTG Pactual said on Tuesday it will launch a stablecoin priced in U.S. dollars at a parity of one to one,...","Apr 4, 2023",2023-04-04
"Brazil evicts miners from Yanomami territory, prepares for more removals",https://www.reuters.com/business/environment/brazil-evicts-miners-yanomami-territory-prepares-more-removals-2023-03-21/,Reuters,"BRASILIA, March 21 (Reuters) - Brazil has ousted almost all illegal gold miners from the Yanomami territory, its largest indigenous reservation, and will...","Mar 22, 2023",2023-03-22
Brazil court backs crackdown on illegal gold mining in Amazon,https://www.reuters.com/world/americas/brazil-court-backs-crackdown-illegal-gold-mining-amazon-2023-04-05/,Reuters,"BRASILIA, April 5 (Reuters) - A Supreme Court judge backed a government move to crack down on illegal gold mining in Brazil, suspending a legal practice of...","Apr 5, 2023",2023-04-05
"Ex bosses of Brazil's Americanas caused difficulties in information disclosure, ex-CEO Rial says",https://www.reuters.com/business/retail-consumer/former-americanas-bosses-created-difficulties-information-disclosure-rial-says-2023-03-28/,Reuters,The former CEO of bankrupt Brazilian retailer Americanas said on Tuesday the firm's previous management had created difficulties in disclosure of...,"Mar 28, 2023",2023-03-28
Focus: Brazil meal payments overhaul delayed by central bank standoff,https://www.reuters.com/markets/brazil-meal-payments-overhaul-delayed-by-central-bank-standoff-2023-03-31/,Reuters,"BRASILIA, March 31 (Reuters) - Fresh competition in Brazil's lucrative meal voucher market must wait, according to people familiar with discussions between...","Mar 31, 2023",2023-03-31
"Brazil court to rule on cannabis cultivation, may open door to planting",https://www.reuters.com/world/americas/brazil-court-rule-cannabis-cultivation-may-open-door-planting-2023-03-20/,Reuters,"SAO PAULO, March 20 (Reuters) - A Brazilian appeals court has agreed to rule on whether companies and farmers can plant cannabis in the country,...","Mar 21, 2023",2023-03-21
China's GWM taps Brazil's WEG for electric vehicle charging network,https://www.reuters.com/business/autos-transportation/chinas-gwm-taps-brazils-weg-electric-vehicle-charging-network-2023-04-04/,Reuters,Chinese electric car maker Great Wall Motors (GWM) on Tuesday said is planning to install an electric vehicle charging network in Brazil through an...,"Apr 4, 2023",2023-04-04
Brazil's revenue service launches electronic invoice for gold to curb illegal mining,https://www.reuters.com/world/americas/brazils-revenue-service-launches-electronic-invoice-gold-curb-illegal-mining-2023-03-30/,Reuters,"SAO PAULO, March 30 (Reuters) - Brazil's Revenue Service on Thursday mandated electronic invoices for gold trade when bullion is declared as a financial...","Mar 30, 2023",2023-03-30
Brazil's Supreme Court seen ditching any govt request to revise Eletrobras privatization -sources,https://www.reuters.com/business/energy/brazils-supreme-court-seen-ditching-any-govt-request-revise-eletrobras-2023-04-04/,Reuters,"BRASILIA, April 4 (Reuters) - Brazil's Supreme Court is expected to reject any request from the country's new leftist government to revise the privatization...","Apr 4, 2023",2023-04-04
"China to decide new date for Brazil's Lula visit, agreements postponed",https://www.reuters.com/world/china-decide-new-date-brazils-lula-visit-agreements-postponed-minister-2023-03-26/,Reuters,Brazil's Agriculture Minister Carlos Favaro said on Sunday that the Chinese government would decide on a new date for Brazilian President Luiz Inacio Lula...,"Mar 26, 2023",2023-03-26
"Brazil's Lula in good health, should travel to China on Sunday -Lula's doctor",https://www.reuters.com/world/americas/brazils-lula-good-health-should-travel-china-sunday-lulas-doctor-2023-03-24/,Reuters,"BRASILIA, March 24 (Reuters) - Brazilian President Luiz Inacio Lula da Silva is in good health after being diagnosed with mild pneumonia, is responding well...","Mar 24, 2023",2023-03-24
Brazil's Americanas faces extended bankruptcy battle with creditors -sources,https://www.reuters.com/markets/deals/brazils-americanas-faces-extended-bankruptcy-battle-with-creditors-sources-2023-03-30/,Reuters,"Brazilian retailer Americanas SA , which filed for bankruptcy protection in January, faces resistance from key creditors to a reorganization plan that could...","Mar 30, 2023",2023-03-30
Casino raises $769.85 million with Assai sale stake in Brazil,https://www.reuters.com/markets/deals/casino-raises-76985-million-with-assai-sale-stake-brazil-2023-03-17/,Reuters,French food retailer Casino said on Friday it had raised 723.2 million euros ($769.85 million) with the sale of another stake in its Brazilian...,"Mar 17, 2023",2023-03-17
Man with axe kills four at crèche in southern Brazil,https://www.reuters.com/world/americas/four-children-killed-pre-school-attack-southern-brazil-2023-04-05/,Reuters,"April 5 (Reuters) - A man armed with a small axe climbed over a wall into a crèche in Southern Brazil and killed four children on Wednesday, police said,...","Apr 5, 2023",2023-04-05
Japan's Nippon Steel to cut its stake in Brazilian Usiminas for Ternium,https://www.reuters.com/markets/deals/japans-nippon-steel-cut-its-stake-brazilian-usiminas-ternium-2023-03-30/,Reuters,Japan's Nippon Steel said on Thursday it would cut its stake in the Brazilian steelmaker Usinas Siderúrgicas de Minas Gerais (Usiminas) to give another...,"Mar 30, 2023",2023-03-30
Which countries allow commercial surrogacy?,https://www.reuters.com/world/which-countries-allow-commercial-surrogacy-2023-04-05/,Reuters,"For-profit surrogacy is banned in Canada, Denmark, New Zealand, Brazil, Britain and Australia, but they all allow some forms of altruistic surrogacy.","Apr 5, 2023",2023-04-05
Brazil allows two Iranian warships to dock in Rio despite US pressure,https://www.reuters.com/world/brazil-allows-two-iranian-warships-dock-rio-despite-us-pressure-2023-02-27/,Reuters,"RIO DE JANEIRO, Feb 27 (Reuters) - Two Iranian warships docked in Rio de Janeiro on Sunday after Brazilian President Luiz Inacio Lula da Silva's government...","Feb 27, 2023",2023-02-27
French retailer Casino selling down stake in Brazil's Assai,https://www.reuters.com/markets/deals/retailer-casino-launches-sale-part-stake-brazilian-company-assai-2023-03-14/,Reuters,Casino on Tuesday launched a sale of shares in Brazilian supermarket chain Assai as the French supermarket operator presses on with cutting its debt.,"Mar 14, 2023",2023-03-14
Deforestation in Brazil's Amazon up in February,https://www.reuters.com/business/environment/deforestation-brazils-amazon-up-february-2023-03-10/,Reuters,"SAO PAULO, March 10 (Reuters) - Deforestation in Brazil's Amazon rainforest rose in February to the highest level on record for the month,...","Mar 10, 2023",2023-03-10
Brazilian real's strength challenged as economy sours,https://www.reuters.com/business/brazilian-reals-strength-challenged-economy-sours-2023-03-03/,Reuters,"BUENOS AIRES, March 3 (Reuters) - Strength in Brazil's real currency will soon be challenged by rising worries about an ongoing downturn in Latin America's...","Mar 3, 2023",2023-03-03
Brazil approves GMO wheat as food supply fears help convince skeptics,https://www.reuters.com/world/americas/brazil-approves-gmo-wheat-food-supply-fears-help-convince-skeptics-2023-03-03/,Reuters,"BUENOS AIRES/SAO PAULO, March 3 (Reuters) - Brazil has approved the cultivation and sale of drought-tolerant genetically modified wheat, a major boost for...","Mar 3, 2023",2023-03-03
"Brazil, Australia open talks on agricultural trade agreements",https://www.reuters.com/markets/commodities/brazil-australia-open-talks-agricultural-trade-agreements-2023-03-10/,Reuters,"SAO PAULO, March 10 (Reuters) - The Brazilian and Australian governments have opened talks aimed at forging new agricultural trade agreements after...","Mar 10, 2023",2023-03-10
Brazil's Lula seeks dialogue with both Venezuelan government and opposition,https://www.reuters.com/world/americas/brazils-lula-seeks-dialogue-with-both-venezuelan-government-opposition-2023-03-09/,Reuters,The Brazilian president's top foreign policy adviser has met with Venezuelan President Nicolas Maduro in the first outreach by Brazil's new leftist...,"Mar 9, 2023",2023-03-09
Brazil's Petrobras faces legal risks after halting asset sales -lawyers,https://www.reuters.com/business/energy/brazils-petrobras-faces-legal-risks-after-halting-asset-sales-lawyers-2023-03-03/,Reuters,Petrobras could face lawsuits for breach of contract after the company halted planned asset sales at the request of Brazilian leftist President Luiz Inacio...,"Mar 3, 2023",2023-03-03
Brazil's Bolsonaro says 'mission still not over' in speech to US CPAC,https://www.reuters.com/world/americas/brazils-bolsonaro-says-mission-still-not-over-speech-us-cpac-2023-03-04/,Reuters,"NATIONAL HARBOR, Maryland, March 4 (Reuters) - Former Brazilian President Jair Bolsonaro said on Saturday his mission was ""still not over"" after leading...","Mar 4, 2023",2023-03-04
"Brazil's Petrobras, Shell to look for joint drilling opportunities",https://www.reuters.com/business/energy/brazils-petrobras-shell-look-joint-drilling-opportunities-2023-03-09/,Reuters,Brazilian state-run company Petrobras and international oil major Shell will work together to identify potential opportunities to explore for and produce...,"Mar 9, 2023",2023-03-09
Brazil senator to probe sale of Petrobras refinery to Mubadala,https://www.reuters.com/business/energy/brazil-senator-probe-sale-petrobras-refinery-mubadala-2023-03-09/,Reuters,"A Brazilian senator called on Thursday for a Congressional investigation into the sale of a Petrobras refinery to United Arab Emirates' Mubadala Capital,...","Mar 9, 2023",2023-03-09
Brazil's Cosan posts profit down 37% after slump in energy unit,https://www.reuters.com/business/energy/brazils-cosan-posts-profit-down-37-after-slump-energy-unit-2023-03-01/,Reuters,"Brazilian conglomerate Cosan SA on Tuesday reported a 37% decrease in fourth-quarter net profit, weighed by poor earnings from its energy subsidiary Raizen...","Feb 28, 2023",2023-02-28
Brazil's RD posts 47% increase in Q4 adjusted net profit,https://www.reuters.com/business/healthcare-pharmaceuticals/brazils-rd-posts-47-increase-q4-adjusted-net-profit-2023-03-07/,Reuters,"Brazilian pharmacy chain RD SA , Raia Drogasil, posted on Tuesday a 47% jump year-over-year in fourth-quarter adjusted net profit to 301.1 million reais...","Mar 7, 2023",2023-03-07
Mad cow case in Brazil dubbed 'atypical' after export bans applied,https://www.reuters.com/business/healthcare-pharmaceuticals/russia-suspends-beef-imports-brazils-para-state-after-mad-cow-case-report-2023-03-02/,Reuters,"SAO PAULO, March 2 (Reuters) - A confirmed case of mad cow disease in Brazil discovered last month is ""atypical,"" the agriculture ministry said on Thursday,...","Mar 2, 2023",2023-03-02
"Brazil's Petrobras cuts gasoline, diesel prices as fuel taxes set to rise",https://www.reuters.com/business/energy/petrobras-brazil-govt-discussed-fuel-price-cut-offset-tax-resumption-sources-2023-02-28/,Reuters,"Brazil's state-run oil giant Petrobras said on Tuesday it will reduce gasoline and diesel prices at its refineries from Wednesday, a move that will likely...","Feb 28, 2023",2023-02-28
Brazil's Itau approves first step to buy all Corpbanca shares,https://www.reuters.com/markets/deals/brazils-itau-approves-first-step-buy-all-corpbanca-shares-2023-03-03/,Reuters,Brazilian lender Itau Unibanco said on Thursday its board had agreed to hire advisors to move forward with a plan to buy the shares it does not yet hold in...,"Mar 2, 2023",2023-03-02
Brazil's Oi files for second bankruptcy protection process,https://www.reuters.com/business/media-telecom/brazils-oi-files-second-bankruptcy-protection-process-2023-03-02/,Reuters,"Brazilian telecoms company Oi SA has filed for a second bankruptcy protection process, it said on Thursday, only months after emerging from a similar...","Mar 2, 2023",2023-03-02
Australia's Carsales.com to raise $329 mln for bigger stake in Brazil's Webmotors,https://www.reuters.com/markets/deals/australias-carsalescom-raise-329-mln-bigger-stake-brazils-webmotors-2023-03-07/,Reuters,Australian online auto classifieds firm Carsales.com Ltd said on Wednesday it was seeking to raise A$500 million ($329.40 million) to buy an extra 40% stake...,"Mar 7, 2023",2023-03-07
Brazil's Haddad says high interest rate is country's main issue,https://www.reuters.com/world/americas/brazils-haddad-says-high-interest-rate-is-countrys-main-issue-2023-03-01/,Reuters,"Brazil's Finance Minister Fernando Haddad said on Wednesday that the country's high interest rate is the primary obstacle to economic growth,...","Mar 1, 2023",2023-03-01
Arezzo buys Italian shoemaker in first acquisition outside Brazil,https://www.reuters.com/markets/deals/arezzo-buys-italian-shoemaker-first-acquisition-outside-brazil-2023-03-03/,Reuters,"Brazilian shoemaker Arezzo Industria e Comercio SA on Friday announced its first acquisition outside the South American country, agreeing to buy Italy's...","Mar 3, 2023",2023-03-03
EU warms to unlocking stalled Mercosur trade deal,https://www.reuters.com/business/eu-warms-unlocking-stalled-mercosur-trade-deal-2023-03-10/,Reuters,"The European Union is warming to the idea of concluding a major free trade deal with Brazil and its Mercosur neighbours, with ""decisive progress"" possible...","Mar 10, 2023",2023-03-10
Brazil's Natura swings to loss as revenue shrinks across cosmetics lines,https://www.reuters.com/business/retail-consumer/brazils-natura-swings-loss-revenue-shrinks-across-cosmetics-lines-2023-03-14/,Reuters,"Brazilian cosmetic maker Natura & Co on Monday reported a fourth-quarter net loss of 890.4 million reais ($169.7 million), as it reported lower revenues...","Mar 13, 2023",2023-03-13
"Americanas scandal won't affect Brazil banks much even in ""extreme scenario"" - cenbank",https://www.reuters.com/business/finance/americanas-scandal-wont-affect-brazil-banks-much-even-extreme-scenario-cenbank-2023-03-09/,Reuters,"BRASILIA, March 9 (Reuters) - Brazil's central bank stated on Thursday that the potential impact of the accounting scandal involving retailer Americanas SA...","Mar 9, 2023",2023-03-09
Deforestation in Brazil's Amazon falls in first month under Lula,https://www.reuters.com/world/americas/deforestation-brazils-amazon-falls-first-month-under-lula-2023-02-10/,Reuters,"SAO PAULO, Feb 10 (Reuters) - Deforestation in Brazil's Amazon rainforest fell in January from a year earlier, satellite data showed on Friday, in the first...","Feb 10, 2023",2023-02-10
Brazil senator says he attended election conspiracy meeting with Bolsonaro,https://www.reuters.com/world/americas/brazilian-senator-says-ex-president-bolsonaro-tried-coerce-him-into-staging-coup-2023-02-02/,Reuters,"BRASILIA, Feb 2 (Reuters) - A Brazilian senator said on Thursday that a close ally of former President Jair Bolsonaro tried to persuade him to join a...","Feb 2, 2023",2023-02-02
"Brazil's vaccine-skeptic Bolsonaro got the shot, document indicates",https://www.reuters.com/world/americas/brazils-vaccine-skeptic-bolsonaro-got-shot-document-indicates-2023-02-18/,Reuters,"BRASILIA, Feb 17 (Reuters) - A health ministry record indicates that former Brazilian President Jair Bolsonaro, a vocal skeptic of COVID-19 vaccines who...","Feb 17, 2023",2023-02-17
Brazil agencies launch raid against illegal gold miners in Yanomami lands,https://www.reuters.com/world/americas/brazil-agencies-launch-raid-against-illegal-gold-miners-yanomami-lands-2023-02-08/,Reuters,"BOA VISTA, Brazil, Feb 8 (Reuters) - Brazil's environmental and indigenous agencies have launched an enforcement operation in the Amazon rainforest to expel...","Feb 8, 2023",2023-02-08
Officer in charge of Brasilia security on Jan. 8 arrested,https://www.reuters.com/world/americas/brazil-police-conduct-new-raids-part-probe-into-brasilia-riots-2023-02-07/,Reuters,"Brazil's federal police on Tuesday arrested the military police officer who led security operations in Brasilia on Jan. 8, when supporters of former...","Feb 7, 2023",2023-02-07
Exclusive: Brazil plans legislation to crack down on laundering of illegal gold,https://www.reuters.com/world/americas/brazil-plans-legislation-crack-down-laundering-illegal-gold-2023-02-16/,Reuters,"BRASILIA, Feb 16 (Reuters) - Brazil's government is taking a fresh tack in its effort to crack down on illegal gold mining in the Amazon,...","Feb 16, 2023",2023-02-16
Brazil sinks rusting old aircraft carrier in the Atlantic,https://www.reuters.com/world/americas/brazil-sinks-rusting-old-aircraft-carrier-atlantic-2023-02-04/,Reuters,"BRASILIA, Feb 4 (Reuters) - Brazil sank a decommissioned aircraft carrier in the Atlantic Ocean off its northeast coast, the Brazilian Navy said,...","Feb 4, 2023",2023-02-04
China says it will set up yuan clearing arrangements in Brazil,https://www.reuters.com/markets/currencies/china-says-it-will-set-up-yuan-clearing-arrangements-brazil-2023-02-07/,Reuters,"BEIJING, Feb 7 (Reuters) - China's central bank has signed a memorandum of understanding on setting up yuan clearing arrangements in Brazil, it said on...","Feb 7, 2023",2023-02-07
OZ Minerals' $6.6 billion buyout by BHP gets Brazil's approval,https://www.reuters.com/business/oz-minerals-66-bln-buyout-by-bhp-gets-brazils-approval-2023-02-05/,Reuters,Australian copper and gold producer OZ Minerals on Monday said its A$9.6 billion ($6.61 billion) buyout by BHP Group received approval from Brazilian...,"Feb 5, 2023",2023-02-05
Brazil to halt beef exports to China after mad cow disease case,https://www.reuters.com/world/americas/brazils-para-state-confirms-mad-cow-disease-case-2023-02-22/,Reuters,"SAO PAULO, Feb 22 (Reuters) - Brazil's beef exports to China will be halted starting Thursday after a case of mad cow disease was confirmed in the northern...","Feb 22, 2023",2023-02-22
Brazil's Lula calls Bolsonaro a Trump 'copycat' in CNN interview,https://www.reuters.com/world/americas/brazils-lula-calls-bolsonaro-trump-copycat-cnn-interview-2023-02-10/,Reuters,"WASHINGTON, Feb 10 (Reuters) - Brazilian President Luiz Inacio Lula da Silva called his far-right predecessor Jair Bolsonaro a ""faithful copycat"" of Donald...","Feb 10, 2023",2023-02-10
Brazil's economic activity rises 2.9% in 2022,https://www.reuters.com/world/americas/brazils-economic-activity-rises-29-2022-2023-02-16/,Reuters,"BRASILIA, Feb 16 (Reuters) - Brazil's economic activity increased by 2.9% in 2022, according to a central bank index released on Thursday, boosted by the...","Feb 16, 2023",2023-02-16
Three dozen dead as Brazil rains cause calamity,https://www.reuters.com/world/americas/two-dozen-dead-after-brazil-rains-cause-calamity-2023-02-20/,Reuters,"SAO PAULO, Feb 19 (Reuters) - Heavy rains in coastal areas of Brazil's southeast have caused flooding and landslides that killed 36 people and dislodged...","Feb 20, 2023",2023-02-20
France minister visits Brazil's Lula amid push for better ties post-Bolsonaro,https://www.reuters.com/world/france-minister-visits-brazils-lula-amid-push-better-ties-post-bolsonaro-2023-02-08/,Reuters,"BRASILIA, Feb 8 (Reuters) - France's foreign minister, Catherine Colonna, met with Brazilian President Luiz Inacio Lula da Silva on Wednesday in a visit...","Feb 8, 2023",2023-02-08
"In Rio de Janeiro, Carnival returns full steam ahead; record tourism expected",https://www.reuters.com/world/americas/rio-de-janeiro-carnival-returns-full-steam-ahead-record-tourism-expected-2023-02-07/,Reuters,"Rio de Janeiro's famously colorful Carnival celebration will return in full force this month and is expected to generate nearly $1 billion in business,...","Feb 7, 2023",2023-02-07
Biden and Lula project unity on democratic values and climate change,https://www.reuters.com/world/us/biden-meet-brazils-lula-talks-climate-democracy-2023-02-10/,Reuters,U.S. President Joe Biden met on Friday with Brazilian leftist President Luiz Inacio Lula da Silva in a reboot of relations between the hemisphere's two...,"Feb 10, 2023",2023-02-10
Brazil's Embraer Defense aims for greater internationalization under new head,https://www.reuters.com/business/aerospace-defense/brazils-embraer-defense-aims-greater-internationalization-under-new-head-2023-02-17/,Reuters,"The defense and security unit of Brazil's Embraer SA is aiming for greater presence abroad in 2023, focusing on boosting sales of its transportation...","Feb 17, 2023",2023-02-17
