title,link,source,snippet,date,absolute_date
Brazil Justice Moraes warns political candidates not to use AI against opponents,https://www.reuters.com/world/americas/brazil-justice-moraes-warns-political-candidates-not-use-ai-against-opponents-2024-02-29/,Reuters,"SAO PAULO, Feb 29 (Reuters) - The head of Brazil's electoral authority Alexandre de Moraes said that candidates in upcoming municipal elections who use...","Feb 29, 2024",2024-02-29
Raging fires in northern Amazon state threaten Brazil's Yanomami people,https://www.reuters.com/world/americas/raging-fires-northern-amazon-state-threaten-brazils-yanomami-people-2024-02-29/,Reuters,"Brazil's northernmost state of Roraima is suffering a sharp spike in wildfires, threatening the crisis-wracked Yanomami Indigenous people and reigniting...","Feb 29, 2024",2024-02-29
"Brazil's Lula slams Israel on Gaza war, says UN failed",https://www.reuters.com/world/brazils-lula-slams-israel-gaza-war-says-un-failed-2024-02-15/,Reuters,"CAIRO, Feb 15 (Reuters) - Brazilian President Luiz Inacio Lula da Silva said on Thursday that the United Nations has failed to resolve international...","Feb 15, 2024",2024-02-15
Brazil's Lula says he wants to resume diplomatic presence in Caribbean nations,https://www.reuters.com/world/americas/brazils-lula-says-he-wants-resume-diplomatic-presence-caribbean-nations-2024-02-28/,Reuters,President Luiz Inacio Lula da Silva said on Wednesday he wanted Brazil to resume having a diplomatic presence in Caribbean countries.,"Feb 28, 2024",2024-02-28
G20 says two-state solution only answer to Israel-Palestinian conflict,https://www.reuters.com/world/middle-east/eu-sees-g20-consensus-two-state-solution-israel-palestinian-conflict-2024-02-22/,Reuters,Foreign ministers at the G20 group of nations meeting in Brazil were nearly unanimous in their support for a two-state solution as the only path to peace in...,"Feb 22, 2024",2024-02-22
"At G20 meeting, Western ministers criticize Russia over Ukraine",https://www.reuters.com/world/g20-ministers-discuss-conflicts-global-governance-brazil-2024-02-21/,Reuters,Western foreign ministers from the G20 group of nations meeting in Brazil on Wednesday attacked Russia for its invasion of Ukraine as Russian Foreign...,"Feb 22, 2024",2024-02-22
Indian police detain three accused of raping Brazilian-Spanish tourist,https://www.reuters.com/world/india/indian-police-detain-three-accused-raping-brazilian-spanish-tourist-2024-03-03/,Reuters,"Indian police have detained three men and are searching for four others accused of attacking two tourists and gang-raping the woman, authorities and the...","Mar 4, 2024",2024-03-04
Brazil's BRF ends seven-quarter losing streak as turnaround pays off,https://www.reuters.com/markets/commodities/brazils-brf-ends-seven-quarter-losing-streak-earns-16526-million-q4-2024-02-26/,Reuters,"Brazilian poultry and pork processor BRF SA turned a profit of 823 million reais ($165.26 million) in the final three months of 2023, according to an...","Feb 27, 2024",2024-02-27
Airline group discusses high costs with Brazil officials,https://www.reuters.com/business/aerospace-defense/airline-group-discusses-high-costs-with-brazil-officials-2024-02-23/,Reuters,"SAO PAULO, Feb 23 (Reuters) - Airline lobby group IATA met with Brazilian government officials this week to discuss the high costs faced by carriers in the...","Feb 23, 2024",2024-02-23
Brazil's Lula proposes law to regulate labor on ride-hailing apps,https://www.reuters.com/world/americas/brazils-lula-proposes-law-regulate-labor-ride-hailing-apps-2024-03-04/,Reuters,"BRASILIA/SAO PAULO, March 4 (Reuters) - Brazilian President Luiz Inacio Lula da Silva sent a bill to congress on Monday to regulate labor rights of workers...","Mar 4, 2024",2024-03-04
Brazilian airline Gol gets court approval for $1 bln bankruptcy loan,https://www.reuters.com/business/aerospace-defense/brazilian-airline-gol-gets-court-approval-1-bln-bankruptcy-loan-2024-02-28/,Reuters,"Bankrupt Brazilian airline Gol received U.S. court approval on Wednesday for a $1 billion loan, after resolving the concerns of a group of lenders that...","Feb 28, 2024",2024-02-28
Brazil unveils FX hedge program for sustainable investments,https://www.reuters.com/world/americas/brazil-unveils-fx-hedge-program-sustainable-investments-2024-02-26/,Reuters,"BRASILIA, Feb 26 (Reuters) - Brazil's finance ministry unveiled on Monday a program aimed at shielding investors from currency risks in sustainable projects...","Feb 26, 2024",2024-02-26
Brazil's PagBank sees net income growth accelerating in 2024,https://www.reuters.com/business/finance/brazils-pagbank-posts-20-increase-fourth-quarter-profit-tpv-growth-2024-02-28/,Reuters,"Brazilian payment firm PagBank said on Wednesday it expects its recurring net income to rise up to 22% in 2024, topping the previous year's growth after its...","Feb 29, 2024",2024-02-29
"Brazil's Dani Alves gets 4-1/2 years for rape in Spain, will appeal",https://www.reuters.com/world/spanish-court-hands-dani-alves-45-year-prison-sentence-over-sexual-assault-2024-02-22/,Reuters,"BARCELONA, Feb 22 (Reuters) - Brazilian footballer Dani Alves was convicted of raping a woman in the restroom of a Barcelona nightclub in 2022 and sentenced...","Feb 22, 2024",2024-02-22
Consortium with China's CRRC to build railroad in Brazil's Sao Paulo state,https://www.reuters.com/business/consortium-with-chinas-crrc-build-railroad-brazils-sao-paulo-state-2024-02-29/,Reuters,A consortium with Brazilian firm Comporte and a subsidiary of Beijing-based company CRRC was the only bidder and won an auction on Thursday for a 30-year...,"Feb 29, 2024",2024-02-29
"Brazil's Suzano posts quarterly profit fall, swaps CEO after 11 years",https://www.reuters.com/markets/brazils-suzano-posts-quarterly-profit-fall-switches-ceo-after-11-years-2024-02-28/,Reuters,"Brazilian pulpmaker Suzano posted on Wednesday a 39% fall in its fourth-quarter net profit from a year earlier as lower pulp prices hit its revenue,...","Feb 29, 2024",2024-02-29
Brazil power industry makes new hydro push despite environmental concerns,https://www.reuters.com/business/energy/brazil-power-industry-makes-new-hydro-push-despite-environmental-concerns-2024-03-05/,Reuters,"SAO PAULO, March 5 (Reuters) - Brazil's energy industry is making a fresh push to build new hydroelectric plants as a complement to surging solar and wind...","Mar 5, 2024",2024-03-05
Brazil's Petrobras increases average jet fuel prices by 8.4%,https://www.reuters.com/business/energy/brazils-petrobras-increases-average-jet-fuel-prices-by-84-2024-03-01/,Reuters,Brazilian state-controlled oil company Petrobras said on Friday it will increase the average prices of jet fuel to distributors by 8.4% starting on Mar. 1.,"Mar 1, 2024",2024-03-01
Brazil police repatriate exotic native animals trafficked to Togo,https://www.reuters.com/world/americas/brazil-police-repatriate-exotic-native-animals-trafficked-togo-2024-02-27/,Reuters,Brazil's federal police and environmental protection agency Ibama have repatriated native parrots and monkeys suspected of having been illegally trafficked...,"Feb 27, 2024",2024-02-27
CEO of Brazil's Taesa resigns; CFO to take over on interim basis,https://www.reuters.com/business/energy/ceo-brazils-taesa-resigns-cfo-take-over-interim-basis-2024-02-21/,Reuters,Brazilian power transmission firm Taesa said on Wednesday that its chief executive Andre Moreira has resigned from the position.,"Feb 21, 2024",2024-02-21
Brazil steelmaker CSN presents bid to buy assets from InterCement,https://www.reuters.com/markets/commodities/brazil-steelmaker-csn-presents-bid-buy-assets-intercement-2024-02-22/,Reuters,"SAO PAULO, Feb 22 (Reuters) - Brazil steelmaker CSN said on Thursday it had presented a bid to buy assets from cement maker InterCement. Sign up here.","Feb 22, 2024",2024-02-22
Petrobras to invest $1.5 billion in HISEP decarbonization tech,https://www.reuters.com/sustainability/climate-energy/petrobras-invest-15-billion-hisep-decarbonization-tech-2024-02-20/,Reuters,"Brazilian state-run oil company Petrobras and partners will invest around $1.5 billion to implement a decarbonization technology in one of their oilfields,...","Feb 20, 2024",2024-02-20
Net tightens on Bolsonaro as police seize passport in coup probe,https://www.reuters.com/world/americas/brazil-police-target-bolsonaro-allies-probe-into-coup-attempt-2024-02-08/,Reuters,"Brazilian police on Thursday confiscated former President Jair Bolsonaro's passport and accused him of editing a draft decree to overturn election results,...","Feb 8, 2024",2024-02-08
Volkswagen to invest a further $1.8 billion in Brazil in next five years,https://www.reuters.com/business/autos-transportation/volkswagen-add-18-bln-brazil-investment-plan-local-media-2024-02-01/,Reuters,German carmaker Volkswagen said on Thursday it will invest an additional 9 billion reais ($1.83 billion) in its Brazilian business over the next five years...,"Feb 2, 2024",2024-02-02
Brazil police target Bolsonaro's son as spy probe hits inner circle,https://www.reuters.com/world/americas/bolsonaro-son-targeted-by-brazils-police-raids-local-media-2024-01-29/,Reuters,"BRASILIA, Jan 29 (Reuters) - Brazilian federal police on Monday searched properties linked to Carlos Bolsonaro, a son of former far-right President Jair...","Jan 29, 2024",2024-01-29
Brazil army colonel arrested in military coup probe on return from US,https://www.reuters.com/world/americas/brazil-army-colonel-arrested-military-coup-probe-return-us-2024-02-11/,Reuters,"BRASILIA, Feb 11 (Reuters) - A Brazilian army colonel wanted by police in an investigation into am attempted coup by associates of Brazil's former far-right...","Feb 11, 2024",2024-02-11
Bolsonaro coup probe weakens Brazil's right-wing opposition,https://www.reuters.com/world/americas/bolsonaro-coup-probe-weakens-brazils-right-wing-opposition-2024-02-12/,Reuters,"BRASILIA, Feb 12 (Reuters) - Police raids on former President Jair Bolsonaro and his associates for allegedly plotting a coup after the 2022 election has...","Feb 12, 2024",2024-02-12
Brazil investigates alleged oil spill from tanker in 2023,https://www.reuters.com/sustainability/climate-energy/brazil-investigates-alleged-oil-spill-tanker-2023-2024-02-01/,Reuters,"BRASILIA, Feb 1 (Reuters) - Brazil is looking for information on an alleged September 2023 tanker oil spill off its northern coast, after non-governmental...","Feb 1, 2024",2024-02-01
"Brazil estimates GDP growth over 2%, inflation to converge to 3% this year, Lula says",https://www.reuters.com/world/americas/brazil-estimates-gdp-growth-over-2-inflation-converge-3-this-year-lula-says-2024-02-05/,Reuters,"BRASILIA, Feb 5 (Reuters) - Brazilian President Luiz Inacio Lula da Silva said on Monday in a letter to Congress that the country should see its economy...","Feb 5, 2024",2024-02-05
Brazil's hydro power adds to global gas surplus,https://www.reuters.com/markets/commodities/brazils-hydro-power-adds-global-gas-surplus-kemp-2024-02-09/,Reuters,"LONDON, Feb 9 (Reuters) - Brazil's gas imports fell to their lowest level for two decades in 2023 as its brimming hydroelectric reservoirs and rapid wind...","Feb 11, 2024",2024-02-11
Brazil farmer bankruptcy filings worry global grain traders,https://www.reuters.com/markets/currencies/brazil-farmer-bankruptcy-filings-worry-global-grain-traders-2024-02-08/,Reuters,"SAO PAULO, Feb 8 (Reuters) - Brazilian grain exporters lobby Anec on Thursday warned it was concerned about a rise in farmer bankruptcy filings in the...","Feb 8, 2024",2024-02-08
"Brazil Indigenous group's crisis persists after 308 deaths in 2023, report says",https://www.reuters.com/world/americas/brazil-indigenous-groups-crisis-persists-after-308-deaths-2023-report-says-2024-01-26/,Reuters,"BRASILIA, Jan 26 (Reuters) - The Brazilian government's effort to evict illegal gold miners from the Yanomami Indigenous reservation in the northern Amazon...","Jan 26, 2024",2024-01-26
"Brazil's Pix to reach 40% of online payment market by 2026, Ebanx study shows",https://www.reuters.com/technology/brazils-pix-reach-40-online-payment-market-by-2026-ebanx-study-shows-2024-01-25/,Reuters,"Brazil's instant payment system Pix will account for more than 40% of the country's online purchases by 2026, a study by fintech Ebanx released on Thursday...","Jan 25, 2024",2024-01-25
Heavily indebted Brazilian airline Gol files for bankruptcy in US,https://www.reuters.com/business/aerospace-defense/brazil-carrier-gol-files-chapter-11-bankruptcy-protection-2024-01-25/,Reuters,"Brazilian airline Gol on Thursday said it is filing for Chapter 11 bankruptcy protection in the United States, the latest in a series of debt restructurings...","Jan 25, 2024",2024-01-25
Brazil intercepts illegal flight over Indigenous land invaded by gold miners,https://www.reuters.com/sustainability/land-use-biodiversity/brazil-intercepts-illegal-flight-over-indigenous-land-invaded-by-gold-miners-2024-01-30/,Reuters,The Brazilian Air Force said on Tuesday it fired warning shots at a plane and forced it to land for violating a no-fly ban over the Yanomami Indigenous...,"Jan 30, 2024",2024-01-30
Brazil's military reinforces border with Venezuela and Guyana due to Esequibo,https://www.reuters.com/world/americas/brazils-military-reinforces-border-with-venezuela-guyana-due-esequibo-2024-02-02/,Reuters,A convoy of military trucks and armored vehicles set off for Brazil's northern border on Friday to reinforce the presence of the Brazilian army in response...,"Feb 3, 2024",2024-02-03
"Brazil spy agency under Bolsonaro allegedly snooped on justices, politicians",https://www.reuters.com/world/americas/brazil-police-launch-raids-over-illegal-spying-during-bolsonaro-years-2024-01-25/,Reuters,"BRASILIA, Jan 25 (Reuters) - Brazil's Abin spy agency allegedly conducted illegal surveillance on at least three Supreme Court Justices and a former Lower...","Jan 25, 2024",2024-01-25
Brazil prosecutors push to unwind $3 billion paper deal over foreign land ownership,https://www.reuters.com/world/americas/brazil-prosecutors-push-unwind-3-bln-paper-deal-over-foreign-land-ownership-2024-02-09/,Reuters,"SAO PAULO, Feb 7 (Reuters) - Brazilian federal prosecutors are asking a judge to unwind a 2017 deal handing control of pulp and paper company Eldorado from...","Feb 9, 2024",2024-02-09
"Raizen, China's BYD to build EV charging station network in Brazil",https://www.reuters.com/business/autos-transportation/raizen-chinas-byd-build-ev-charging-station-network-brazil-2024-02-02/,Reuters,Sugar and ethanol firm Raizen and Chinese automaker BYD are joining forces to create a network of 600 charging stations for electric vehicles (EVs) in eight...,"Feb 2, 2024",2024-02-02
Brazil candidate for Interpol says time for a head from developing nation,https://www.reuters.com/world/brazils-candidate-head-interpol-says-time-non-western-leader-2024-02-05/,Reuters,"BRASILIA, Feb 5 (Reuters) - Interpol should elect a new head from a developing nation to diversify the organisation and boost its credibility as crime...","Feb 5, 2024",2024-02-05
"Brazil orders Vale, BHP and Samarco to pay $9.7 bln in damages for dam disaster",https://www.reuters.com/business/brazils-justice-sentences-vale-bhp-samarco-pay-97-bln-damage-repair-2024-01-25/,Reuters,A Brazilian federal judge ruled that miners Vale and BHP and their joint venture Samarco must pay 47.6 billion reais ($9.67 billion) in damages for a 2015...,"Jan 26, 2024",2024-01-26
Brazil's central govt deficit soars in 2023 to 2nd-largest ever,https://www.reuters.com/world/americas/brazils-central-govt-deficit-soars-2023-marking-second-largest-ever-recorded-2024-01-29/,Reuters,"BRASILIA, Jan 29 (Reuters) - Brazil's central government primary budget deficit reached 230.5 billion reais ($47 billion) in 2023, Treasury data showed on...","Jan 29, 2024",2024-01-29
"Brazil fashion companies Arezzo, Soma to merge, faced increasing competition",https://www.reuters.com/markets/deals/brazil-fashion-companies-arezzo-soma-agree-merger-2024-02-05/,Reuters,Brazilian fashion companies Arezzo&Co and Grupo Soma said on Monday they had agreed to a merger to create a entity which will be 54% controlled by Arezzo.,"Feb 5, 2024",2024-02-05
Brazilian airline Gol probes rival's effort to poach aircraft,https://www.reuters.com/business/aerospace-defense/brazilian-airline-gol-probes-rivals-effort-poach-aircraft-2024-02-12/,Reuters,Bankrupt Brazilian airline Gol on Monday received a U.S. court's permission to probe rival LATAM Airlines' alleged effort to poach Gol's Boeing 737...,"Feb 12, 2024",2024-02-12
Analysis: Why the next two years will make or break battle to rescue tropical forests,https://www.reuters.com/sustainability/land-use-biodiversity/analysis-why-next-two-years-will-make-or-break-battle-rescue-tropical-forests-2024-02-06/,Reuters,"Summary. Deforestation in the Cerrado, Brazil's agricultural heartland, increased by 43% in 2022 despite falling in Amazon; President Lula da Silva in drive...","Feb 6, 2024",2024-02-06
Brazil prosecutors seek annulment of contract for Belo Sun gold mine,https://www.reuters.com/sustainability/land-use-biodiversity/brazil-prosecutors-seek-annulment-contract-belo-sun-gold-mine-2024-02-06/,Reuters,"BRASILIA, Feb 6 (Reuters) - Brazilian federal prosecutors asked a judge to annul a contract between Canadian miner Belo Sun and Brazil's land rights agency...","Feb 6, 2024",2024-02-06
Amazon Fund for rainforest received $640 million in new pledges in 2023,https://www.reuters.com/sustainability/climate-energy/amazon-fund-rainforest-received-640-mln-new-pledges-2023-2024-02-01/,Reuters,"Brazil's Amazon Fund for sustainable rainforest development received $640 million in new pledged donations from developed nations last year,...","Feb 1, 2024",2024-02-01
Dengue spreads fast in Brazil prompting emergency health measures,https://www.reuters.com/business/healthcare-pharmaceuticals/dengue-spreads-fast-brazil-prompting-emergency-health-measures-2024-02-07/,Reuters,"Dengue fever has surged in Brazil's hot rainy season, forcing health authorities to take emergency measures and start mass vaccination against the...","Feb 8, 2024",2024-02-08
Brazil's Embraer reports 2023 aircraft deliveries slightly below guidance,https://www.reuters.com/business/aerospace-defense/brazils-embraer-delivers-75-aircraft-q4-2024-01-30/,Reuters,"Brazilian planemaker Embraer reported on Tuesday deliveries of 75 jets in the fourth quarter, making both its executive and commercial jets slightly miss...","Jan 30, 2024",2024-01-30
Brazil renewable energy to get bigger subsidy on 2024 electric bills -regulator,https://www.reuters.com/business/energy/brazil-renewable-energy-get-bigger-subsidy-2024-electric-bills-regulator-2024-02-09/,Reuters,"SAO PAULO, Feb 9 (Reuters) - The subsidy for renewable energy sources in Brazil will surpass that of the fossil fuel bill for thermoelectric plants by 2024,...","Feb 9, 2024",2024-02-09
"Brazil sees 2024 public debt growth of up to 13.5%, eyes increased external issuance",https://www.reuters.com/world/americas/brazil-sees-public-debt-growth-up-135-2024-advances-debt-lengthening-2024-01-30/,Reuters,"BRASILIA, Jan 30 (Reuters) - Brazil expects its public debt to surge by as much as 13.5% in 2024 and aims to progress in its lengthening while projecting a...","Jan 30, 2024",2024-01-30
Gol airline receives court approval to borrow $350 million in bankruptcy,https://www.reuters.com/business/aerospace-defense/brazils-gol-says-debt-hit-41-bln-end-2023-2024-01-29/,Reuters,"A U.S. bankruptcy judge on Monday allowed Brazilian airline Gol to borrow the first $350 million of its proposed bankruptcy financing, which a company...","Jan 29, 2024",2024-01-29
South America dengue spike prompts vaccination drive as bug spray runs out,https://www.reuters.com/world/americas/south-america-dengue-spike-prompts-vaccination-drive-bug-spray-runs-out-2024-01-25/,Reuters,"South America is seeing a surge in cases of the mosquito-borne disease dengue during the southern hemisphere summer, prompting Brazil to roll out a novel...","Jan 25, 2024",2024-01-25
Brazil intelligence agency's second-in-command fired in illegal spying probe,https://www.reuters.com/world/americas/brazil-intelligence-agencys-second-in-command-fired-illegal-spying-probe-2024-01-31/,Reuters,Brazil's president fired a top official from the country's intelligence agency on Tuesday amid a probe into suspected illegal spying during the presidency...,"Jan 31, 2024",2024-01-31
Brazil beefs up its military presence in the Amazon,https://www.reuters.com/world/americas/brazil-beefs-up-its-military-presence-amazon-2024-02-12/,Reuters,Border tensions over Guyana's Esequibo and the humanitarian crisis among the Yanomami Indigenous people have led Brazil's army to increase its forces in the...,"Feb 12, 2024",2024-02-12
Brazil creates 1.484 mln jobs in 2023 after worse-than-expected December,https://www.reuters.com/world/americas/brazil-creates-1484-mln-jobs-2023-after-worse-than-expected-december-2024-01-30/,Reuters,"Brazil ended 2023 with a net creation of 1.484 million jobs, said the Labor Ministry on Tuesday, a result that followed disappointing figures from December.","Jan 30, 2024",2024-01-30
"EssilorLuxottica revenue up 7.1% in Q4 driven by China, Brazil",https://www.reuters.com/business/retail-consumer/essilorluxottica-revenue-up-71-q4-driven-by-china-brazil-2024-02-14/,Reuters,"Revenue at eyewear maker EssilorLuxottica rose 7.1% at constant exchange rates in the last quarter of 2023 boosted by China and Brazil, reaching 6.25...","Feb 14, 2024",2024-02-14
Brazil's Natura mulls new listing for Avon's business outside Latin America,https://www.reuters.com/business/brazils-natura-mulls-splitting-natura-latam-avon-into-separate-listings-2024-02-06/,Reuters,"Brazilian cosmetics maker Natura &Co said on Monday its board authorised management to study splitting its Avon brand outside Latin America,...","Feb 5, 2024",2024-02-05
Brazil prioritizes streamlining access to green funds in G20 presidency,https://www.reuters.com/sustainability/sustainable-finance-reporting/brazil-prioritizes-streamlining-access-green-funds-g20-presidency-2024-02-06/,Reuters,"BRASILIA, Feb 6 (Reuters) - Brazil deems easing access to major green funds as a critical action and a top priority for the country during its presidency of...","Feb 6, 2024",2024-02-06
"Meeting between Brazil's govt, airlines, Petrobras called off",https://www.reuters.com/business/aerospace-defense/meeting-between-brazils-govt-airlines-petrobras-called-off-2024-02-01/,Reuters,"A meeting that was scheduled to happen between Brazil's government, local airlines and state-run oil firm Petrobras on Thursday has been canceled,...","Feb 1, 2024",2024-02-01
Mercedes-Benz moves into truck rental market in Brazil,https://www.reuters.com/business/autos-transportation/mercedes-benz-moves-into-truck-rental-market-brazil-2024-02-06/,Reuters,"Daimler Truck said on Tuesday it will launch its first truck rental business in Brazil, where the vehicle leasing market is expanding.","Feb 6, 2024",2024-02-06
Sigma Lithium plans to invest $100 mln on new Brazil plant,https://www.reuters.com/markets/commodities/sigma-lithium-plans-invest-100-mln-new-brazil-plant-2024-02-12/,Reuters,"Sigma Lithium , a leader in Brazil's budding lithium sector, said on Monday it planned to invest 492.4 million reais ($99.4 million) on a previously...","Feb 12, 2024",2024-02-12
Brazil's Itau Unibanco sees loan book growth picking up in 2024,https://www.reuters.com/business/finance/brazils-itau-unibanco-reports-4-growth-fourth-quarter-profit-2024-02-05/,Reuters,"Brazil's largest private lender, Itau Unibanco , on Monday said it expects to accelerate lending this year, while net interest income growth should slow...","Feb 5, 2024",2024-02-05
Brazil's Petrobras oil and gas output rises 3.7% in 2023,https://www.reuters.com/markets/commodities/brazils-petrobras-produces-278-mln-boed-oil-gas-2023-2024-01-26/,Reuters,"Brazilian state-run oil company Petrobras' output rose last year to 2.78 million barrels of oil equivalent per day (boepd), up 3.7% from 2022, according to...","Jan 26, 2024",2024-01-26
Brazil's Gol does not foresee layoffs related to Chapter 11 process,https://www.reuters.com/business/aerospace-defense/brazils-gol-does-not-foresee-layoffs-related-chapter-11-process-2024-01-26/,Reuters,"Brazilian airline Gol does not expect its Chapter 11 proceedings to trigger job cuts, its chief executive said on Friday, reiterating that the carrier's...","Jan 26, 2024",2024-01-26
Brazil marks anniversary of Jan. 8 attack on democracy,https://www.reuters.com/world/americas/brazil-mark-anniversary-january-8-attack-democracy-2024-01-08/,Reuters,"BRASILIA, Jan 8 (Reuters) - Brazilian authorities celebrated their country's democratic system on Monday, a year after a right-wing crowd invaded and...","Jan 8, 2024",2024-01-08
Shares in Brazil's Gol tank on report of potential US bankruptcy filing,https://www.reuters.com/business/aerospace-defense/brazils-gol-considering-chapter-11-bankruptcy-report-says-2024-01-15/,Reuters,Shares in Brazilian airline Gol tumbled on Monday after local newspaper Folha de S.Paulo reported that the company was considering filing for Chapter 11...,"Jan 15, 2024",2024-01-15
Deforestation in Brazil's Amazon down by 50% to five-year low in 2023,https://www.reuters.com/world/americas/deforestation-brazils-amazon-down-by-50-five-year-low-2023-2024-01-12/,Reuters,"SAO PAULO, Jan 12 (Reuters) - Deforestation in Brazil's Amazon rainforest in 2023 halved from the previous year to its lowest level since 2018,...","Jan 12, 2024",2024-01-12
