title,link,source,snippet,date,absolute_date
Brazil's Bolsonaro says VP Mourao will not be his election running mate,https://www.reuters.com/world/americas/brazils-bolsonaro-says-vp-mourao-will-not-be-his-running-mate-this-year-2022-03-21/,Reuters,"BRASILIA, March 21 (Reuters) - Brazilian President Jair Bolsonaro said on Monday that Vice President Hamilton Mourao will not be his running mate in...","Mar 21, 2022",2022-03-21
Brazil's Lula aims for closer ties with Mexico's leftist ruling party,https://www.reuters.com/world/americas/brazils-lula-aims-closer-ties-with-mexicos-leftist-ruling-party-2022-03-03/,Reuters,"MEXICO CITY, March 2 (Reuters) - Former Brazilian president Luiz Inacio Lula da Silva oversaw the signing of a pact on Wednesday between his leftist party...","Mar 2, 2022",2022-03-02
Venezuela re-opens border with Brazil after two years,https://www.reuters.com/world/americas/venezuela-brazil-re-open-border-after-two-years-2022-02-25/,Reuters,"Venezuela re-opened its land borderwith Brazil on Thursday, nearly two years after the government of President Nicolas Maduro shuttered crossings over...","Feb 25, 2022",2022-02-25
Telegram joins program from Brazil's Electoral Court to fight fake news,https://www.reuters.com/business/media-telecom/telegram-joins-program-brazils-electoral-court-fight-fake-news-2022-03-25/,Reuters,Messaging app Telegram on Friday signed an agreement to join a program created by Brazil's Electoral Court to combat misinformation ahead of the country's...,"Mar 25, 2022",2022-03-25
EXCLUSIVE Petrobras and EIG near deal for Bolivia-Brazil gas pipeline -sources,https://www.reuters.com/business/energy/exclusive-petrobras-eig-near-deal-bolivia-brazil-gas-pipeline-sources-2022-03-14/,Reuters,"SAO PAULO/RIO DE JANEIRO, March 14 (Reuters) - State-run Brazilian oil company Petrobras is close to reaching an agreement to sell to U.S. private equity...","Mar 14, 2022",2022-03-14
Brazilian man with floating home of scrap strives for environmental change,https://www.reuters.com/business/environment/brazilian-man-with-floating-home-scrap-strives-environmental-change-2022-03-22/,Reuters,"On a trash-filled river in Rio de Janeiro, passersby look in awe as Luiz Fernando Barreto floats atop the home he has assembled from scrap wood,...","Mar 23, 2022",2022-03-23
"Far from Russian invasion, Ukrainian Brazilians pray for peace",https://www.reuters.com/world/far-russian-invasion-ukrainian-brazilians-pray-peace-2022-02-25/,Reuters,"More than 12000 kilometers (7450 miles) away from the violence of the Russian invasion, some 200 Brazilians of Ukrainian descent gathered on Thursday to...","Feb 25, 2022",2022-02-25
City Football Group bid for Atletico Mineiro - report,https://www.reuters.com/markets/funds/city-football-group-bid-atletico-mineiro-report-2022-03-07/,Reuters,"City Football Group (CFG), the Abu Dhabi company with investments in Manchester City and 10 other football clubs, has made a bid to buy Brazilian league...","Mar 7, 2022",2022-03-07
"As fuel prices rise to record highs, governments look for solutions",https://www.reuters.com/business/energy/fuel-prices-rise-record-highs-governments-look-solutions-2022-03-10/,Reuters,"Retail gasoline and diesel prices soared to record highs in many countries across the world this week, prompting governments from Brazil to France to...","Mar 10, 2022",2022-03-10
Deforestation in Brazil's Amazon rainforest hits record January high,https://www.reuters.com/business/environment/deforestation-brazils-amazon-rainforest-hits-record-january-high-2022-02-11/,Reuters,"SAO PAULO, Feb 11 (Reuters) - Brazil recorded the most deforestation ever in the Amazon rainforest for the month of January, according to government data on...","Feb 11, 2022",2022-02-11
China's Great Wall says will invest $1.8 bln in Brazil over next decade,https://www.reuters.com/business/autos-transportation/chinas-great-wall-says-will-invest-19-bln-brazil-over-next-decade-2022-01-28/,Reuters,China's Great Wall Motor said on Friday it will invest 11.5 billion yuan ($1.81 billion) over the next decade to build electric vehicles in Brazil where its...,"Jan 28, 2022",2022-01-28
EXCLUSIVE Nubank sees Brazil downturn as a chance to grow faster -CEO,https://www.reuters.com/business/finance/exclusive-nubank-sees-brazil-downturn-chance-grow-faster-ceo-2022-02-02/,Reuters,"SAO PAULO, Feb 2 (Reuters) - Brazil's economic downturn may represent an opportunity for Latin America's newest listed lender to gain market share...","Feb 2, 2022",2022-02-02
White House rebukes Brazil's Bolsonaro for 'solidarity' visit to Moscow,https://www.reuters.com/world/americas/white-house-rebukes-brazils-bolsonaro-solidarity-visit-moscow-2022-02-18/,Reuters,"BRASILIA, Feb 18 (Reuters) - The White House on Friday criticized Brazilian President Jair Bolsonaro's visit this week to Moscow in the midst of the Ukraine...","Feb 18, 2022",2022-02-18
Brazil startup Rentbrella eyes European expansion after U.S. rollout,https://www.reuters.com/technology/brazil-startup-rentbrella-eyes-european-expansion-after-us-rollout-2022-01-26/,Reuters,"Jan 25 (Reuters) - A Brazilian umbrella-sharing app, which has for several months been giving New Yorkers a way to cope with unexpected downpours,...","Jan 26, 2022",2022-01-26
"Brazil central bank chief says higher interest rates, positive fiscal are supporting FX",https://www.reuters.com/world/americas/brazil-central-bank-chief-says-higher-interest-rates-are-supporting-fx-2022-02-22/,Reuters,Brazil's central bank chief Roberto Campos Neto said on Tuesday that higher interest rates to combat double-digit inflation are supporting financial inflows...,"Feb 22, 2022",2022-02-22
"Latam stocks outshine the world in January, Brazil in focus",https://www.reuters.com/world/americas/latam-stocks-outshine-world-january-brazil-focus-2022-02-01/,Reuters,Latin American stocks outperformed their peers and the developed world in January and some regional currencies are among the strongest against the dollar so...,"Feb 1, 2022",2022-02-01
"Heavy rains cause landslides and flooding in São Paulo, killing 19",https://www.reuters.com/world/americas/heavy-rains-cause-landslides-flooding-so-paulo-killing-18-2022-01-30/,Reuters,"BRASILIA, Jan 30 (Reuters) - Landslides and flooding from heavy rains in Sao Paulo state have killed at least 19 people since Friday, including seven...","Jan 31, 2022",2022-01-31
U.S. denounces Bolsonaro's 'solidarity' with Russia as Ukraine crisis brews,https://www.reuters.com/world/us-denounces-bolsonaros-solidarity-with-russia-ukraine-crisis-brews-2022-02-18/,Reuters,"The United States on Thursday criticized Brazilian President Jair Bolsonaro's declaration of ""solidarity"" with Russia during a visit there this week as it...","Feb 17, 2022",2022-02-17
"Heavy rains, flooding kill dozens in Brazil's 'Imperial City'",https://www.reuters.com/business/environment/heavy-rain-leaves-least-34-dead-brazils-petropolis-2022-02-16/,Reuters,"RIO DE JANEIRO, Feb 16 (Reuters) - At least 94 people died in the historic Brazilian mountain town of Petropolis, local government officials said on...","Feb 16, 2022",2022-02-16
Brazil's clearwater Tapajos river polluted by illegal gold mining,https://www.reuters.com/business/environment/brazils-clearwater-tapajos-river-polluted-by-illegal-gold-mining-2022-01-24/,Reuters,"BRASILIA, Jan 24 (Reuters) - The browning of one of Brazil's largest clearwater rivers, the Tapajos, is almost certainly due to the mud and sentiments...","Jan 24, 2022",2022-01-24
EXCLUSIVE Brazil has oil. Exxon can't seem to find it,https://www.reuters.com/business/energy/exclusive-brazil-has-oil-exxon-cant-seem-find-it-2022-02-14/,Reuters,"Exxon Mobil Corp has bet billions of dollars on offshore drilling in Brazil, an area it once abandoned and now sees as key to its future.","Feb 14, 2022",2022-02-14
"Brazil's presidential race tightens, new poll shows",https://www.reuters.com/world/americas/brazils-presidential-race-tightens-new-poll-shows-2022-02-02/,Reuters,"Former leftist President Luiz Inacio Lula da Silva's lead over far-right incumbent President Jair Bolsonaro has tightened somewhat, to 11 percentage points...","Feb 2, 2022",2022-02-02
Google expands in Brazil seeking to improve areas of privacy and security,https://www.reuters.com/technology/google-expands-brazil-seeking-improve-areas-privacy-security-2022-01-26/,Reuters,"Alphabet Inc's Google is slated to hire 200 engineers in Brazil this year, as it seeks to bolster its privacy, security, and anti-abusive content...","Jan 25, 2022",2022-01-25
Yara buys 14% stake in Brazil farm trade platform Orbia,https://www.reuters.com/business/yara-buys-14-stake-brazil-farm-trade-platform-orbia-2022-02-16/,Reuters,A unit of Norwegian plant nutrition company Yara International ASA has acquired for an undisclosed sum a 14% stake in Brazilian online farm products trade...,"Feb 16, 2022",2022-02-16
Brazil punishing drought clogs shallow lagoon with dead fish,https://www.reuters.com/world/americas/brazil-punishing-drought-clogs-shallow-lagoon-with-dead-fish-2022-02-07/,Reuters,"TAVARES, Brazil, Feb 7 (Reuters) - Under a vast gray sky, fisherman Daniel de Matos Rosa waded through the shallow waters of a southern Brazilian lagoon...","Feb 7, 2022",2022-02-07
Gavilon deal to make Glencore major soy exporter in Brazil with larger U.S. foothold,https://www.reuters.com/markets/europe/gavilon-deal-make-glencore-major-soy-exporter-brazil-with-larger-us-foothold-2022-01-27/,Reuters,"Jan 27 (Reuters) - Global commodities merchant Glencore Plc (GLEN.L) , opens new tab took a major step this week to becoming a greater force in the...","Jan 27, 2022",2022-01-27
Italy issues international arrest warrant for Brazilian Robinho,https://www.reuters.com/world/italy-issues-international-arrest-warrant-brazilian-robinho-2022-02-16/,Reuters,"ROME, Feb 16 (Reuters) - Italy's Justice Ministry has issued an international arrest warrant for former AC Milan and Brazil striker Robinho after the...","Feb 16, 2022",2022-02-16
COVID-hit Queen Elizabeth sends message to Brazil,https://www.reuters.com/world/uk/queen-elizabeth-expected-speak-with-pm-johnson-by-telephone-2022-02-21/,Reuters,"LONDON, Feb 21 (Reuters) - Britain's Queen Elizabeth sent a message of condolence to Brazil on Monday as she continued to carry out official duties despite...","Feb 21, 2022",2022-02-21
Brazil's economy minister Guedes says he would stay for Bolsonaro second term,https://www.reuters.com/world/americas/brazils-economy-minister-guedes-says-he-would-stay-bolsonaro-second-term-2022-02-22/,Reuters,"BRASILIA, Feb 22 (Reuters) - Brazilian Economy Minister Paulo Guedes said he was ready to remain in office for a potential second term of President Jair...","Feb 22, 2022",2022-02-22
Mudslides and floods kill at least 117 in Brazil's Petropolis,https://www.reuters.com/business/environment/death-toll-brazils-petropolis-rises-104-after-heavy-rains-2022-02-17/,Reuters,"PETROPOLIS, Brazil, Feb 17 (Reuters) - The death toll from mudslides and floods in Brazil's colonial-era city of Petropolis rose to 117 on Thursday and was...","Feb 17, 2022",2022-02-17
"Brazil's Petrobras has record output, sales of low-sulfur diesel",https://www.reuters.com/business/energy/brazils-petrobras-has-record-output-sales-low-sulfur-diesel-2022-01-28/,Reuters,"Brazilian state-run oil company Petrobras said on Friday it produced a record 21.2 billion liters of S-10 diesel in 2021, up 10% from a year earlier,...","Jan 28, 2022",2022-01-28
"Brazil's Enauta cuts investment in Atlanta, may sell stake",https://www.reuters.com/business/energy/brazils-enauta-cuts-investment-atlanta-may-sell-stake-2022-01-25/,Reuters,"Brazilian oil firm Enauta has cut investment in the Santos basin's Atlanta field, as it decides whether to involve new partners in the asset, the company's...","Jan 25, 2022",2022-01-25
"Brazil's BNDES raises $370 mln in meatpacker JBS shares sale, says executive",https://www.reuters.com/business/brazils-bndes-raises-370-mln-meatpacker-jbs-shares-sale-says-executive-2022-02-16/,Reuters,"Brazil's state-controlled development bank BNDES sold on Wednesday 50 million shares of the meatpacker JBS SA , raising about 1.9 billion reais ($369.90...","Feb 16, 2022",2022-02-16
"Death toll in Brazil's Petropolis mudslides, floods hits 176; more than 110 missing",https://www.reuters.com/business/environment/death-toll-brazils-petropolis-mudslides-floods-hits-176-more-than-110-missing-2022-02-21/,Reuters,"RIO DE JANEIRO, Feb 21 (Reuters) - The death toll from last week's mudslides and floods in the Brazilian city of Petropolis reached 176 as of Monday, Rio de...","Feb 21, 2022",2022-02-21
Brazil energy company Cosan reports Q4 net income of $248 mln,https://www.reuters.com/business/energy/brazil-energy-company-cosan-reports-q4-net-income-248-mln-2022-02-19/,Reuters,"Brazilian energy and logistics company Cosan SA on Friday reported a quarterly net income of 1.277 billion reais ($248.52 million), higher than the 112...","Feb 19, 2022",2022-02-19
Nestle to double investments in Brazil in 2022 as it expands output capacity,https://www.reuters.com/business/nestle-double-investments-brazil-2022-it-expands-output-capacity-2022-02-22/,Reuters,Nestle SA said on Tuesday it will almost double its investments in Brazil in 2022 from a year earlier as it builds a new pet food factory and looks to...,"Feb 22, 2022",2022-02-22
Protests against murder of Congolese immigrant focus on racism in Brazil,https://www.reuters.com/world/americas/protests-against-murder-congolese-immigrant-focus-racism-brazil-2022-02-05/,Reuters,Hundreds of demonstrators on Saturday demanded justice and decried racism at the beachside kiosk in Rio de Janeiro where a Congolese immigrant was beaten to...,"Feb 5, 2022",2022-02-05
Brazil health regulator approves COVID-19 self-tests for sale in drugstores,https://www.reuters.com/world/americas/brazil-health-regulator-approves-covid-19-self-tests-sale-drugstores-2022-01-28/,Reuters,Brazilian health regulator Anvisa on Friday approved the sale of COVID-19 self-tests in drugstores across the country as the Omicron variant of the...,"Jan 28, 2022",2022-01-28
Brazil plans to unleash $707 mln in fresh agriculture subsidies - source,https://www.reuters.com/world/americas/brazil-plans-unleash-707-mln-fresh-agriculture-subsidies-source-2022-02-10/,Reuters,"BRASILIA, Feb 9 (Reuters) - Brazil's government plans to unveil 3.7 billion reais ($706.73 million) in fresh agriculture subsidies after its initial...","Feb 9, 2022",2022-02-09
"SoftBank, Riverwood lead $93 mln investment in Brazilian HR startup Gupy",https://www.reuters.com/markets/funds/softbank-riverwood-lead-93-mln-investment-brazilian-hr-startup-gupy-2022-01-31/,Reuters,"SAO PAULO, Jan 31 (Reuters) - Brazilian digital human resources startup Gupy said on Monday it has raised 500 million reais ($93.15 million) in a funding...","Jan 31, 2022",2022-01-31
"Brutal killing of Congolese refugee shocks Brazil, three arrested",https://www.reuters.com/world/americas/brutal-killing-congolese-refugee-shocks-brazil-three-arrested-2022-02-02/,Reuters,"RIO DE JANEIRO, Feb 2 (Reuters) - Brazilian police have made three arrests after the deadly beating of a Congolese refugee, captured on security camera...","Feb 2, 2022",2022-02-02
Brazil energy company Energisa acquires Gemini in $159 mln deal,https://www.reuters.com/business/energy/brazil-energy-company-energisa-acquires-gemini-159-mln-deal-2022-02-17/,Reuters,Brazilian energy company Energisa Transmissao de Energia SA said on Thursday it has agreed to acquire power transmission company Gemini Energy SA in a deal...,"Feb 17, 2022",2022-02-17
Brazil's Petrobras approves sale of Polo Norte Capixaba fields for $544 mln,https://www.reuters.com/business/energy/brazils-petrobras-approves-sale-polo-norte-capixaba-fields-544-mln-2022-02-22/,Reuters,"SAO PAULO, Feb 22 (Reuters) - Brazil's state-owned Brazilian oil company Petrobras said on Tuesday it had approved the sale of its entire stake in four...","Feb 22, 2022",2022-02-22
Brazilian anchor says his fainting on air was not caused by booster,https://www.reuters.com/article/fact-check/brazilian-anchor-says-his-fainting-on-air-was-not-caused-by-booster-idUSL1N2U721U/,Reuters,"Claims that Brazilian anchor Rafael Silva collapsed during a live transmission because he had received a COVID-19 booster shot are inaccurate, according to...","Jan 27, 2022",2022-01-27
"Brazil, Guyana and Suriname to take first steps towards energy alliance",https://www.reuters.com/business/energy/brazil-guyana-suriname-take-first-steps-towards-energy-alliance-2022-01-20/,Reuters,"Jan 20 (Reuters) - The heads of state of Brazil, Guyana and Suriname this week will take the first steps toward forging an infrastructure that would better...","Jan 20, 2022",2022-01-20
Brazil 2021 inflation highest since 2015; central bank vows tighter policy,https://www.reuters.com/world/americas/brazil-2021-inflation-highest-since-2015-central-bank-vows-tighter-policy-2022-01-11/,Reuters,"BRASILIA, Jan 11 (Reuters) - Brazil's annual inflation hit a six-year high of over 10% in 2021, government data showed on Tuesday, well above the central...","Jan 11, 2022",2022-01-11
Uber to bow out of Brazil restaurant deliveries,https://www.reuters.com/technology/uber-end-uber-eats-operations-brazil-report-2022-01-06/,Reuters,Uber said on Thursday it will end its Uber Eats restaurant delivery service in Brazil from March 7 and focus instead on deliveries by its online groceries...,"Jan 6, 2022",2022-01-06
Jump in deforestation of world's most biodiverse savanna alarms Brazilian scientists,https://www.reuters.com/business/environment/jump-deforestation-worlds-largest-savanna-alarms-brazilian-scientists-2022-01-03/,Reuters,"SAO PAULO, Jan 3 (Reuters) - Deforestation last year rose to the highest level since 2015 in Brazil's Cerrado, prompting scientists on Monday to raise alarm...","Jan 4, 2022",2022-01-04
Dams burst in northeastern Brazil as region hit by floods,https://www.reuters.com/markets/commodities/dam-collapses-northeastern-brazil-after-torrential-rain-2021-12-26/,Reuters,"ITABUNA, Brazil, Dec 26 (Reuters) - Two dams gave way in the northeastern Brazilian state of Bahia after weeks of heavy rains, swamping already swollen...","Dec 26, 2021",2021-12-26
Brazil extends coal use to 2040 under new 'just transition' law,https://www.reuters.com/markets/deals/brazil-extends-coal-use-2040-under-new-just-transition-law-2022-01-06/,Reuters,"RIO DE JANEIRO, Jan 6 (Thomson Reuters Foundation) - Brazil will continue to use and subsidize coal as an energy source until at least 2040, according to a...","Jan 6, 2022",2022-01-06
Brazil electoral court could ban Telegram app for not fighting fake news,https://www.reuters.com/technology/brazil-electoral-court-could-ban-telegram-app-not-fighting-fake-news-2022-01-20/,Reuters,"Brazil's top electoral authority, the TSE, is considering whether to ban the messaging app Telegram during the run-up to October elections because it has...","Jan 20, 2022",2022-01-20
Brazil stops tracking savanna deforestation despite rising destruction,https://www.reuters.com/markets/us/brazil-stops-tracking-savanna-deforestation-despite-rising-destruction-2022-01-06/,Reuters,"SAO PAULO, Jan 6 (Reuters) - Brazil will stop monitoring deforestation in the Cerrado, the world's most species-rich savanna, a government researcher said...","Jan 6, 2022",2022-01-06
Brazilian samba singer Elza Soares dead at 91,https://www.reuters.com/world/americas/brazilian-samba-singer-elza-soares-dead-91-2022-01-20/,Reuters,"Elza Soares, one of the most revered singers in Brazilian samba music, died at her home in Rio de Janeiro on Thursday, aged 91.","Jan 20, 2022",2022-01-20
Brazil farmers struggle as drought batters southern soy crop,https://www.reuters.com/world/americas/brazil-farmers-struggle-drought-batters-southern-soy-crop-2022-01-12/,Reuters,"SOLEDADE, Brazil, Jan 12 (Reuters) - Soybean farmers in southern Brazil are reeling from a prolonged drought that some expect to wipe out up to 90% of their...","Jan 12, 2022",2022-01-12
"Brazil's Bolsonaro hospitalized with obstructed gut, may need surgery",https://www.reuters.com/world/americas/brazils-bolsonaro-taken-hospital-with-abdominal-pain-doctor-says-2022-01-03/,Reuters,"SAO PAULO/BRASILIA, Jan 3 (Reuters) - Brazilian President Jair Bolsonaro was hospitalized on Monday with an intestinal blockage and may need to undergo...","Jan 3, 2022",2022-01-03
"In Brazil, charcoal industry fuels illegal deforestation and slavery",https://www.reuters.com/article/world/in-brazil-charcoal-industry-fuels-illegal-deforestation-and-slavery-idUSKBN2JF0PK/,Reuters,"For more than a year, Antonio slept with a wasp nest humming above his head - not in the open but inside a small brick house on a farm a couple of hours...","Jan 5, 2022",2022-01-05
"Brazil's Bolsonaro refuses flood aid from Argentina, drawing Bahia rebuke",https://www.reuters.com/markets/commodities/brazils-bolsonaro-refuses-flood-aid-argentina-drawing-bahia-rebuke-2021-12-30/,Reuters,"RIO DE JANEIRO, Dec 30 (Reuters) - Brazilian President Jair Bolsonaro rejected an offer of aid from Argentina, saying on Thursday that his country did not...","Dec 30, 2021",2021-12-30
Heavy rains leave Brazil indigenous group homeless again,https://www.reuters.com/world/americas/heavy-rains-leave-brazil-indigenous-group-homeless-again-2022-01-12/,Reuters,"SAO JOAQUIM DE BICAS, Brazil, Jan 12 (Reuters) - Three years ago, the collapse of the tailings dam at an iron ore mine forced them to move their homes to...","Jan 12, 2022",2022-01-12
Death toll from Brazil flooding rises in Bahia's 'worst disaster' ever,https://www.reuters.com/markets/commodities/death-toll-brazil-flooding-rises-bahias-worst-disaster-ever-2021-12-27/,Reuters,"ITABUNA, Brazil, Dec 27 (Reuters) - The death toll from floods hammering northeast Brazil rose to 20 on Monday, as the governor of Bahia state declared it...","Dec 28, 2021",2021-12-28
Brazil's BNDES plans to sell stake in Ouro Fino,https://www.reuters.com/markets/deals/brazils-bndes-plans-sell-stake-ouro-fino-2022-01-04/,Reuters,"SAO PAULO, Jan 4 (Reuters) - Brazilian veterinary products manufacturer Ouro Fino Saude Animal SA said on Monday state development bank BNDES hired BTG...","Jan 4, 2022",2022-01-04
"Brazil's Copel considers buying Rio Energy, Equinor also interested -report",https://www.reuters.com/business/energy/brazils-copel-considers-buying-rio-energy-equinor-also-interested-report-2022-01-14/,Reuters,"Brazilian power company Copel is considering acquiring renewable power firm Rio Energy, newspaper Estadao reported on Friday, saying the move could be...","Jan 14, 2022",2022-01-14
Brazil's WEG and Neoenergia announce partnership in charging stations for electric vehicles,https://www.reuters.com/technology/brazils-weg-neoenergia-announce-partnership-charging-stations-electric-vehicles-2022-01-18/,Reuters,Brazilian motor maker WEG SA announced on Tuesday a partnership with power company Neoenergia SA to provide charging stations for electric vehicles.,"Jan 18, 2022",2022-01-18
"Colombian startup Tul raises $181 million, plans Brazil, Mexico expansion",https://www.reuters.com/markets/europe/colombian-startup-tul-raises-181-million-plans-brazil-mexico-expansion-2022-01-11/,Reuters,"Colombian startup Tul, an e-commerce platform that sells construction materials to small-sized retailers, announced on Tuesday it has raised $181 million in...","Jan 11, 2022",2022-01-11
Brazil tycoon Tanure to bid for 100% of Alliar if controlling stake is reached,https://www.reuters.com/markets/deals/brazil-tycoon-tanure-bid-100-alliar-if-controlling-stake-is-reached-2022-01-05/,Reuters,"SAO PAULO, Jan 5 (Reuters) - Brazilian investment firm MAM Asset Management, controlled by tycoon Nelson Tanure, said late on Tuesday it plans to make a...","Jan 5, 2022",2022-01-05
Death toll from Brazil waterfall rock face collapse rises to 10,https://www.reuters.com/world/americas/death-toll-brazil-waterfall-rock-face-collapse-rises-10-2022-01-09/,Reuters,"Ten people died in the dramatic collapse of a canyon rock face on top of motor boats visiting a waterfall in southeastern Brazil, rescuers said on Sunday.","Jan 9, 2022",2022-01-09
Brazil's Bolsonaro discharged from hospital after gut blockage cleared,https://www.reuters.com/world/americas/brazils-bolsonaro-discharged-hospital-after-gut-blockage-2022-01-05/,Reuters,"Brazilian President Jair Bolsonaro was discharged from hospital on Wednesday, two days after being admitted with an intestinal obstruction,...","Jan 5, 2022",2022-01-05
Russia's COVID-19 death toll climbs to world's second highest,https://www.reuters.com/world/europe/russias-covid-19-death-toll-climbs-worlds-second-highest-2021-12-30/,Reuters,"Russia has overtaken Brazil to have the world's second-highest death toll from the COVID-19 pandemic, behind the United States, data from Russia's state...","Dec 30, 2021",2021-12-30
"Brazil health ministry website hit by hackers, vaccination data targeted",https://www.reuters.com/technology/brazils-health-ministry-website-hit-by-hacker-attack-systems-down-2021-12-10/,Reuters,"BRASILIA, Dec 10 (Reuters) - Brazil's health ministry said its website was hit on Friday by a hacker attack that took several systems down, including one...","Dec 10, 2021",2021-12-10
Insight: A Brazilian town empties as migration to U.S. accelerates,https://www.reuters.com/world/americas/brazilian-town-empties-migration-us-accelerates-2021-11-30/,Reuters,"ALPERCATA, Brazil, Nov 30 (Reuters) - Amid tearful goodbyes, Ana Paula Souza, her husband and their infant son set off for the United States,...","Nov 30, 2021",2021-11-30
